{
  "contractVersion": 1,
  "controlByteCount": 512,
  "observations": [
    {
      "kind": "frozenTemplate",
      "length": 64,
      "observationID": "44444444-4444-4444-8444-444444444444",
      "sha256": "1111111111111111111111111111111111111111111111111111111111111111",
      "status": "present"
    }
  ],
  "operation": "newNote",
  "payloads": [
    {
      "id": "22222222-2222-4222-8222-222222222222",
      "kind": "text",
      "text": "Synthetic capture text."
    }
  ],
  "preparationRevision": 1,
  "presetSnapshotHash": "0000000000000000000000000000000000000000000000000000000000000000",
  "rendererRevision": "swift-legacy-m0",
  "requestID": "11111111-1111-4111-8111-111111111111",
  "session": {
    "maximumAggregateObservationBytes": 268435456,
    "maximumChunkBytes": 1048576
  },
  "snapshotHash": "0000000000000000000000000000000000000000000000000000000000000000"
}
